{"$id":"https://surfaces.local/schemas/source-family-component-identity-mapping-preflight-mutation.v0.schema.json","$schema":"https://json-schema.org/draft/2020-12/schema","additionalProperties":false,"properties":{"expectedDiagnosticCodes":{"items":{"minLength":1,"type":"string"},"type":"array","uniqueItems":true},"fixtureId":{"minLength":1,"type":"string"},"identityPackageId":{"const":"team-button-to-button-fixed-identity-package"},"kind":{"enum":["valid","review","mutation"]},"mutation":{"oneOf":[{"type":"null"},{"additionalProperties":false,"properties":{"changes":{"items":{"additionalProperties":false,"properties":{"caseId":{"minLength":1,"type":"string"},"expectedDiagnosticCode":{"type":["string","null"]},"operation":{"enum":["replace-json","add-json","remove-json","remove-file","prepopulate-root","append-text","append-array-value"]},"path":{"minLength":1,"type":"string"},"value":{}},"required":["caseId","operation","path","value","expectedDiagnosticCode"],"type":"object"},"type":"array"},"operation":{"enum":["replace-json","add-json","remove-json","remove-file","prepopulate-root","append-text","append-array-value","ordered-changes"]},"path":{"type":["string","null"]},"target":{"enum":["authority-declaration","p2-evidence","namespace-evidence","component-identity-mapping","identity-package","stage-workspace","stage-chain","namespace-mapping","namespace-package","persisted-inner-artifact","compiler-source","final-evidence"]},"value":{}},"required":["target","operation","path","value","changes"],"type":"object"}]},"schemaId":{"const":"source-family-component-identity-mapping-preflight-mutation.v0"},"version":{"const":"0.0.0"}},"required":["schemaId","version","fixtureId","kind","mutation","expectedDiagnosticCodes","identityPackageId"],"title":"source-family-component-identity-mapping-preflight-mutation.v0","type":"object"}