{"expectedDiagnosticCodes":["SOURCE_FACT_AUTHORITY_ESCALATION"],"fixtureId":"source-fact-authority-escalation.source-family-component-identity-mapping-preflight","identityPackageId":"team-button-to-button-fixed-identity-package","kind":"mutation","mutation":{"changes":[],"operation":"append-array-value","path":"components/button.json#/facts/0/value","target":"compiler-source","value":"expressive"},"schemaId":"source-family-component-identity-mapping-preflight-mutation.v0","version":"0.0.0"}