{"expectedDiagnosticCodes":["SOURCE_IDENTITY_AUTHORITY_HASH_MISMATCH"],"fixtureId":"authority-hash-mismatch.source-family-component-identity-mapping-preflight","identityPackageId":"team-button-to-button-fixed-identity-package","kind":"mutation","mutation":{"changes":[],"operation":"replace-json","path":"/authorityDeclarationRef/sha256","target":"component-identity-mapping","value":"0000000000000000000000000000000000000000000000000000000000000000"},"schemaId":"source-family-component-identity-mapping-preflight-mutation.v0","version":"0.0.0"}