{"expectedDiagnosticCodes":["SOURCE_IDENTITY_NAMESPACE_DESCRIPTOR_HASH_MISMATCH"],"fixtureId":"namespace-descriptor-hash-mismatch.source-family-component-identity-mapping-preflight","identityPackageId":"team-button-to-button-fixed-identity-package","kind":"mutation","mutation":{"changes":[],"operation":"replace-json","path":"/mappingId","target":"namespace-mapping","value":"tampered-namespace-mapping"},"schemaId":"source-family-component-identity-mapping-preflight-mutation.v0","version":"0.0.0"}