{"expectedDiagnosticCodes":["SOURCE_IDENTITY_EXTRA_POINTER"],"fixtureId":"extra-pointer.source-family-component-identity-mapping-preflight","identityPackageId":"team-button-to-button-fixed-identity-package","kind":"mutation","mutation":{"changes":[],"operation":"add-json","path":"/substitutions/-","target":"component-identity-mapping","value":{"from":"TeamButton","logicalPath":"components/in-line-alert.json","physicalPath":"ui/inline-notice.json","pointer":"/notes","to":"Button"}},"schemaId":"source-family-component-identity-mapping-preflight-mutation.v0","version":"0.0.0"}