{"expectedDiagnosticCodes":["SOURCE_IDENTITY_STAGE_REVERSED"],"fixtureId":"stage-order-reversed.source-family-component-identity-mapping-preflight","identityPackageId":"team-button-to-button-fixed-identity-package","kind":"mutation","mutation":{"changes":[],"operation":"replace-json","path":"/orderedStages","target":"stage-chain","value":["source-conformance-compile","namespace-normalization","component-identity"]},"schemaId":"source-family-component-identity-mapping-preflight-mutation.v0","version":"0.0.0"}