{"expectedDiagnosticCodes":["SOURCE_IDENTITY_NAMESPACE_NORMALIZER_HASH_MISMATCH"],"fixtureId":"namespace-normalizer-hash-mismatch.source-family-component-identity-mapping-preflight","identityPackageId":"team-button-to-button-fixed-identity-package","kind":"mutation","mutation":{"changes":[],"operation":"replace-json","path":"/namespaceNormalizerRefs/0/hash","target":"identity-package","value":"0000000000000000000000000000000000000000000000000000000000000000"},"schemaId":"source-family-component-identity-mapping-preflight-mutation.v0","version":"0.0.0"}