{"expectedDiagnosticCodes":["SOURCE_IDENTITY_NAMESPACE_EVIDENCE_NONPASS"],"fixtureId":"nonpass-namespace-evidence.source-family-component-identity-mapping-preflight","identityPackageId":"team-button-to-button-fixed-identity-package","kind":"mutation","mutation":{"changes":[],"operation":"replace-json","path":"/status","target":"namespace-evidence","value":"fail"},"schemaId":"source-family-component-identity-mapping-preflight-mutation.v0","version":"0.0.0"}