{"expectedDiagnosticCodes":["SOURCE_IDENTITY_EVIDENCE_HASH_MISMATCH"],"fixtureId":"evidence-hash-mismatch.source-family-component-identity-mapping-preflight","identityPackageId":"team-button-to-button-fixed-identity-package","kind":"mutation","mutation":{"changes":[{"caseId":"artifact-ref","expectedDiagnosticCode":"SOURCE_IDENTITY_EVIDENCE_HASH_MISMATCH","operation":"replace-json","path":"/artifacts/0/hash","value":"0000000000000000000000000000000000000000000000000000000000000000"},{"caseId":"ordered-remap","expectedDiagnosticCode":"SOURCE_IDENTITY_INNER_EVIDENCE_INVALID","operation":"replace-json","path":"/identityMappedEvidenceRemap/artifactMappings/0/persistedPath","value":"artifacts/source-family-component-identity-mapping/substituted.json"},{"caseId":"self-hash","expectedDiagnosticCode":"SOURCE_IDENTITY_EVIDENCE_HASH_MISMATCH","operation":"replace-json","path":"/runId","value":"0000000000000000000000000000000000000000000000000000000000000000"}],"operation":"ordered-changes","path":null,"target":"final-evidence","value":null},"schemaId":"source-family-component-identity-mapping-preflight-mutation.v0","version":"0.0.0"}