{"expectedDiagnosticCodes":["SOURCE_IDENTITY_UPSTREAM_EVIDENCE_NONPASS"],"fixtureId":"nonpass-p2-evidence.source-family-component-identity-mapping-preflight","identityPackageId":"team-button-to-button-fixed-identity-package","kind":"mutation","mutation":{"changes":[],"operation":"replace-json","path":"/status","target":"p2-evidence","value":"fail"},"schemaId":"source-family-component-identity-mapping-preflight-mutation.v0","version":"0.0.0"}