{"expectedDiagnosticCodes":["SOURCE_IDENTITY_NAMESPACE_HASH_MISMATCH"],"fixtureId":"tampered-namespace-evidence.source-family-component-identity-mapping-preflight","identityPackageId":"team-button-to-button-fixed-identity-package","kind":"mutation","mutation":{"changes":[],"operation":"replace-json","path":"/command","target":"namespace-evidence","value":"tampered-namespace-command"},"schemaId":"source-family-component-identity-mapping-preflight-mutation.v0","version":"0.0.0"}