{"expectedDiagnosticCodes":["SOURCE_IDENTITY_BASELINE_MISMATCH"],"fixtureId":"baseline-bypass.source-family-component-identity-mapping-preflight","identityPackageId":"team-button-to-button-fixed-identity-package","kind":"mutation","mutation":{"changes":[],"operation":"prepopulate-root","path":"sources/source-family-namespace-mapping/team-owned-namespaced-bundle","target":"stage-workspace","value":"accepted-namespace-baseline"},"schemaId":"source-family-component-identity-mapping-preflight-mutation.v0","version":"0.0.0"}