{"expectedDiagnosticCodes":["SOURCE_IDENTITY_BOUNDARY_EXPANSION"],"fixtureId":"package-boundary-expansion.source-family-component-identity-mapping-preflight","identityPackageId":"team-button-to-button-fixed-identity-package","kind":"mutation","mutation":{"changes":[],"operation":"add-json","path":"/actions","target":"identity-package","value":["execute"]},"schemaId":"source-family-component-identity-mapping-preflight-mutation.v0","version":"0.0.0"}