{"expectedDiagnosticCodes":["SOURCE_IDENTITY_NAMESPACE_STAGE_SKIPPED"],"fixtureId":"namespace-stage-skipped.source-family-component-identity-mapping-preflight","identityPackageId":"team-button-to-button-fixed-identity-package","kind":"mutation","mutation":{"changes":[],"operation":"remove-json","path":"/orderedStages/1","target":"stage-chain","value":null},"schemaId":"source-family-component-identity-mapping-preflight-mutation.v0","version":"0.0.0"}