{"expectedDiagnosticCodes":["SOURCE_IDENTITY_SIXTH_FILE_EXPANSION"],"fixtureId":"sixth-file.source-family-component-identity-mapping-preflight","identityPackageId":"team-button-to-button-fixed-identity-package","kind":"mutation","mutation":{"changes":[],"operation":"replace-json","path":"/substitutions/0/physicalPath","target":"component-identity-mapping","value":"ui/inline-notice.json"},"schemaId":"source-family-component-identity-mapping-preflight-mutation.v0","version":"0.0.0"}